Datetime,Username,Translated_Tweets,Location,Cleaned_Tweets
2022-02-25 08:16:55+00:00,muda_puchong,"Yesterday, Young Puchong with @mudaxbangi to the Selangor Islamic University College (KUIS) to help students get food in quarantine.

Helps that have been delivered
- 50 packs of food (bread, biscuits etc.)
- 60 boxes of mineral water https://t.co/nbzfcfyixd",,yesterday young puchong selangor islamic university college kui help student get food quarantine help delivered pack food bread biscuit etc box mineral water
2022-02-27 13:30:05+00:00,JJCMPERAK,"This is not in Padang Ipoh, Ipoh but in Kampung Padang Ipoh, Kuala Berang, Terengganu. A Malaysian Civil Defense Force (APM) truck was turned upside down today.

The truck brought food assistance to be delivered to flood victims.

📸Mohd Khairul Fikiri/Bernama https://t.co/rpsov1ypej","Perak, Malaysia",padang ipoh ipoh kampung padang ipoh kuala berang terengganu malaysian civil defense force apm truck turned upside today truck brought food assistance delivered flood victim mohd khairul fikiribernama
2022-02-27 15:39:02+00:00,adamapotek,It's not like that all of them don't know different tasks. That is every time you ask for assemblymen and moneylumers/assistance/road repair/etccc,"Selangor, Malaysia",like dont know different task every time ask assemblyman moneylumersassistanceroad repairetccc
2022-03-09 23:19:42+00:00,nrhznsofea,"This is the case, the latest opah I am Umno, the time of the CPP at the UMNO org is not helped. I have a YB PKR food box bg 😅. Please do the time for the election to be lost 😔","Perak, Malaysia",case latest opah umno time cpp umno org helped yb pkr food box bg please time election lost
2022-03-12 03:09:03+00:00,Media_Selangor,LZS: Five Positive Asnaf Families #Covid19 Receive food help https://t.co/yopgktflp8 https://t.co/qdg3mumsos,Shah Alam,lzs five positive asnaf family receive food help
2022-03-25 06:16:32+00:00,paanpogba,"@aimanseeran when you can set an appointment with this Zakat CEO, would you like to ask for MCD food for weekly?","Kuala Lumpur, Wilayah Persekutuan Kuala Lumpur",set appointment zakat ceo would like ask mcd food weekly
2022-03-30 02:15:34+00:00,luxentX,"@pedoqpop Covid Age. Everyone's economic situation is uncertain. Some T20 used to fall B40, ask for a food basket. To ask for help, some don't know where to ask. The HEIs should ask the student and find out who can help.",Petaling Jaya,covid age everyones economic situation uncertain used fall b ask food basket ask help dont know ask heis ask student find help
2022-03-31 17:13:32+00:00,allexseah_bm,"The DAP Service Center Kesiders together with NGO SXY provide food assistance to 20 families in need, may all their family members be healthy. 🇲🇾

*Thanks to all the contributors, volunteers and members of the DAP Assembly Unit. https://t.co/ult1ranerh",,dap service center kesiders together ngo sxy provide food assistance family need may family member healthy thanks contributor volunteer member dap assembly unit
2022-04-02 03:39:56+00:00,limlipeng,"He was a 77 -year -old single, having trouble walking, living under the TNB substation and relying on food help from the public. He said all the brothers were dead. He refused to stay in a senior citizen's house. He just wants us to help him get @jkmhq help. https://t.co/6idrckgobp",Kuala Lumpur,year old single trouble walking living tnb substation relying food help public said brother dead refused stay senior citizen house want u help get help
2022-04-02 11:15:29+00:00,UniMalayaSDC,"Happy Ramadan, the best tarbiyah month to be a sustainable person

1. Tadabbur Quran & amp; Hadith in life
2. Use water & amp; electricity in charge
3. Say not to waste & amp; leftovers
4. Many give: alms, gifts, help

#salamramadan https://t.co/lciduxiydz",Kuala Lumpur,happy ramadan best tarbiyah month sustainable person tadabbur quran amp hadith life use water amp electricity charge say waste amp leftover many give alms gift help
2022-04-05 06:00:20+00:00,THBM_HQ,"05042022 - In Pendang

Ihya 'Ramadan 1443 H
Basic food assistance

600 donkey donation sessions for asnaf around Pendang

perfected -
General Manager #thbmhq
Mr @firdaus_thbm

Hope to help them accordingly

#Thbwecare https://t.co/lbhmcb40ke",Alor Setar,pendang ihya ramadan h basic food assistance donkey donation session asnaf around pendang perfected general manager mr hope help accordingly
2022-05-19 09:02:24+00:00,SDC_Nilai,"Cempaka Village in need of basic food help.

The pilgrims or residents in need of help are welcome to come to the Cempaka Village Surau Gerobok. InshaAllah

“𝑹𝒆𝒛𝒆𝒌𝒊 𝑺𝒂𝒎𝒂 𝑫𝒊𝒌𝒐𝒏𝒈𝒔𝒊
𝑴𝒖𝒂𝒇𝒂𝒌𝒂𝒕 𝑴𝒆𝒏𝒋𝒂𝒅𝒊 𝑬𝒓𝒕𝒊 ”","Negri Sembilan, Malaysia",cempaka village need basic food help pilgrim resident need help welcome come cempaka village surau gerobok inshaallah
2022-06-18 00:04:34+00:00,Media_Selangor,108 UNISEL ASNAF STUDENTS Receive free food help https://t.co/asss3wglh5 https://t.co/zfoeowc9yu,Shah Alam,unisel asnaf student receive free food help
2022-06-21 12:10:01+00:00,noraakira,Stress to see the news of the cooking oil to ride the chicken to go up ... the subsidy is for help to those who miss it ... so that other people x need help ... .,Malaysia,stress see news cooking oil ride chicken go subsidy help miss people x need help
2022-07-05 09:50:20+00:00,AbdullahMY74,"@IsmailSabri60 The most impressive group is the student. Please also see the students in primary and secondary schools, especially the Rentan and the B40.

Food ceiling price help for IPT students. We say thousands of thanks.",Kuala Lumpur,impressive group student please also see student primary secondary school especially rentan b food ceiling price help ipt student say thousand thanks
2022-07-12 00:41:06+00:00,Media_Selangor,"Aidiladha: 100 Residents Receive Food Help, Sacrifice https://t.co/5fltlj3ovv https://t.co/zpimwtiaww",Shah Alam,aidiladha resident receive food help sacrifice
2022-07-23 05:50:04+00:00,CheapremeBrand,"#Limatunting #turun

1. Cut the minister's salary
2. Maintain subsidies
3. Distribute dignified help
4. Control the price of goods
5. Complete the food supply

#Byrakyat4rakyat https://t.co/whbui7yqgr",Wilayah Persekutuan Kuala Lump,cut minister salary maintain subsidy distribute dignified help control price good complete food supply
2022-08-14 14:24:24+00:00,burningredberry,"Finish the 179th serving. Food Assistance on the homeless & amp; poor city

#Dapuri travel https://t.co/lmahp8urlg",Ipoh | Malaysia,finish th serving food assistance homeless amp poor city travel
2022-08-16 15:35:26+00:00,addien90s,"Bismillah, my team and my @myfundaction are safe in Sabah. InshaAllah starting tomorrow for a week, we will enter the interior of Sabah to provide lessons and food to mualaf, children and locals. This is a thread throughout our mission here. Stay tuned! https://t.co/ag57mig6ty",,bismillah team safe sabah inshaallah starting tomorrow week enter interior sabah provide lesson food mualaf child local thread throughout mission stay tuned
2022-08-28 09:40:53+00:00,allexseah_bm,"Providing a little food help to a mother, her son was born for not enough months and entered the ward for 6 months.
捐助 一些 物 给予 这 位 印裔 妈妈 ， 他 的 孩子 早产 ， 之前 住院长 达 6 个 月。
#Allexseah #谢守钦 https://t.co/duyfzn3fau",,providing little food help mother son born enough month entered ward month
2022-08-30 05:51:48+00:00,Fitri_Nizam,Let's give you RM30 for their daily dietary purposes🥺,Malaysia,let give rm daily dietary purpose
2022-09-28 03:40:44+00:00,AliBiju_my,"September 27, 2022, Tuesday:

Submission of fire assistance in Kampung Darat, Kabong

Earlier, staff from the P.205 Saratok Service Center went down the field to provide a little help in the form of basic essential foods as an initial assistance https://t.co/mwclg8fvpp","Saratok, Sarawak",september tuesday submission fire assistance kampung darat kabong earlier staff p saratok service center went field provide little help form basic essential food initial assistance
2022-09-30 09:14:08+00:00,yeolahv,"""But pills are expensive""

No, they're cheap. Only if you bother to listen to the KK Nurse after giving birth you must know this is not up to RM10 at KK

You really feel better to buy food, so don't worry about the kids and don't ask for help",Malaysia,pill expensive theyre cheap bother listen kk nurse giving birth must know rm kk really feel better buy food dont worry kid dont ask help
2022-10-07 12:39:19+00:00,farahfarawayyy,@Onenyta is sad. But the purpose of this food help is to ensure that the children are nutritious. 😓,"Kuala Lumpur,Malaysia",sad purpose food help ensure child nutritious
2022-10-20 12:29:52+00:00,RakyatB40,"How to apply for RM 300 food help through MyKasih.

How To Apply ⤵️
https://t.co/zhalgszqzb",Malaysia,apply rm food help mykasih apply
2022-10-31 01:56:04+00:00,cempedakhangit,"One thing to order in Anwar Ibrahim, the Tambun people are used to the government's help, food aid, the charity porridge, the charity of the lemongrass is normal. So if he wins the soul of the parents in this Tambun area, please continue this charity/ help.",Ipoh,one thing order anwar ibrahim tambun people used government help food aid charity porridge charity lemongrass normal win soul parent tambun area please continue charity help
2022-12-01 05:57:58+00:00,F_SyimaM,"@Kakchikashakc because it has to stop this food help. DBKL has stopped but something else does. Sometimes food is more abundant. If it's time to fast again.
There are also many programs for the underwear Under YKN. But that's it ..","Setapak, Selangor",stop food help dbkl stopped something else sometimes food abundant time fast also many program underwear ykn thats
2022-12-07 13:00:55+00:00,HelmiHarieri,"I don't even like him. But this chapter saw him ahead. And his presentation to the villagers is good. That's why Kedah can go to Pn.

Want to increase immediate help to good farmers. But the name of the ministry has the slices of food. Got to forward thinking a little",,dont even like chapter saw ahead presentation villager good thats kedah go pn want increase immediate help good farmer name ministry slice food got forward thinking little
2022-12-13 05:52:53+00:00,Zaki_Yamani_,"For the help of this poor there is always a protest.

Hang Tuah Jaya Parliament starts monthly food assistance every month in 2019, some ask ""Wouldn't it be every month?"" Do you remember people having a hard time eating a month, fasting a month? Or just eat the GE campaign time?",,help poor always protest hang tuah jaya parliament start monthly food assistance every month ask wouldnt every month remember people hard time eating month fasting month eat ge campaign time
2022-12-19 01:11:03+00:00,Media_Selangor,"LZS HELP FOOD HELP, DAILY REQUIREMENTS TO THE BIG FLOWER VEHICLE https://t.co/b3qmj49nkm",Shah Alam,lzs help food help daily requirement big flower vehicle
2022-12-21 03:12:39+00:00,saifnasution,"This is part of a string of efforts and initiatives that have been moved. This relief mission is a joint venture with the Food Bank Malaysia Foundation involving an early 1000 food box.

2/3 https://t.co/k5fzhs9y4z",Kulim Bandar Baharu,part string effort initiative moved relief mission joint venture food bank malaysia foundation involving early food box
2022-12-21 08:19:15+00:00,Fariszuone10,"Like to be reminded.

Food assistance to flood victims if possible to eat such as

✅ KURMA (Highly Recommended)
✅ Bread
✅ Biscuits
✅ Mineral water
✅ Package food
✅ Water box

Can for rice.
Include it once with the food above.",Kuala Terengganu,like reminded food assistance flood victim possible eat kurma highly recommended bread biscuit mineral water package food water box rice include food
2022-12-21 11:09:41+00:00,Aminadri_,"• 50 families in Sungai Limau receive food basket help
• 30 Pedu Students Receive RM300 State IPT Assistance

Full news on Facebook page Darul Aman's Faithful Facebook

#Urasses.
#Upda

Kedah continues to be prosperous with Islam 🥰",,family sungai limau receive food basket help pedu student receive rm state ipt assistance full news facebook page darul amans faithful facebook kedah continues prosperous islam
2022-12-22 06:26:23+00:00,AbangAirul,@mynewshub are la pya bangs old is busy to raise .. Food help thrown from the sky ??,"Gombak, Selangor",la pya bang old busy raise food help thrown sky
2022-12-24 10:50:49+00:00,akmalarif90,"Daily

Distribute 12.4 tonnes of food assistance to flood victims

25 minutes ago - https://t.co/s5hv0owb1p",Malaysia,daily distribute tonne food assistance flood victim minute ago
2022-12-26 07:12:07+00:00,ummah_today,"PLACE: 4 -wheel drive Volunteer Volunteer Mapim Rangers forces to provide assistance such as basic necessities and hot food to flood affected residents including those who do not move to temporary evacuation centers (PPS)

https://t.co/ya652uzxuz",,place wheel drive volunteer volunteer mapim ranger force provide assistance basic necessity hot food flood affected resident including move temporary evacuation center pps
2022-12-27 09:54:58+00:00,Aminadri_,"Rubber tappers are affected receiving help

BALING- Nine rubber tappers from Kampung Charok Kelian received a donation of food baskets from Baling Member of Parliament, Ustaz Hassan Saad this afternoon.

23.12.2022 https://t.co/zgz1tpsvuw",,rubber tapper affected receiving help baling nine rubber tapper kampung charok kelian received donation food basket baling member parliament ustaz hassan saad afternoon
2022-12-28 15:29:06+00:00,Aminadri_,"Thankfully, it was completed to distribute food baskets to households in Kg Alor Durian which was affected by the flood.
 
Thank God best MB🥰

#ybpas
#mbpas
#kelantan https://t.co/lvziyypcmw",,thankfully completed distribute food basket household kg alor durian affected flood thank god best mb
2022-12-30 17:04:05+00:00,AhmadZarulAfiq1,"We hope the #Maribantan volunteers with medical assistance, the basic food will arrive tomorrow morning in Kelantan. We're moving! https://t.co/hvwvfnxkom",,hope volunteer medical assistance basic food arrive tomorrow morning kelantan moving
2023-01-28 10:55:05+00:00,JapenSabah,"2,586 kir receives food basket help

🔗https: //t.co/emvqx7ikd9

#Japensabah https://t.co/yjj6ubr8kf","Kota Kinabalu, Sabah",kir receives food basket help tcoemvqxikd
2023-02-14 11:43:36+00:00,afaizalfy,Errrr… a little bit of the cost of traveling can cover how many medicines or food help you can deliver,Damansara Heights,errrr little bit cost traveling cover many medicine food help deliver
2023-02-25 02:41:22+00:00,YCyodi,Cat ok and chicken eats his food but not dogs .. his dog is driving him to call people for help if he takes food or place https://t.co/rwyrgnsjjg,"Yan, Kedah",cat ok chicken eats food dog dog driving call people help take food place
2023-02-27 04:00:44+00:00,AnasAmdan,"The project begins during the pandemic.

Our Association (Help) is actively providing food baskets around Sabah.

For help, we also received complaints from local farmers that they could not sell their vegetables.

Total waste can be 500kg! https://t.co/j0kdzid4AV","Kota Kinabalu, Sabah",project begin pandemic association help actively providing food basket around sabah help also received complaint local farmer could sell vegetable total waste kg
2023-03-03 06:11:35+00:00,ProudOrangAsli,"Because it seems that many villages are affected and need help not only food items but include clothing, blankets, mattresses/mats, mineral water, gas stoves and more. https://t.co/9cjeqjj5zl",,seems many village affected need help food item include clothing blanket mattressesmats mineral water gas stove
2023-03-03 14:30:14+00:00,outlaw__J,And the worst thing? Help at PPS xsampai. Water is gone. Camne wants to pee. Xde pound food. Basic Necessities xde.,J's Pocket,worst thing help pps xsampai water gone camne want pee xde pound food basic necessity xde
2023-03-04 23:52:26+00:00,suffikamari,"It's been an update here and there PMX, Focus & amp; Seriously help @onnhafiz MB Johor is facing this flood. Ask all ministers to pay serious attention. Sadly what happened in Johor to Limited Food Help in Chaah area! @anwaribrahim @saifnasution @fahmi_fadzil","Ulu Kelang, Selangor",update pmx focus amp seriously help mb johor facing flood ask minister pay serious attention sadly happened johor limited food help chaah area
2023-03-06 15:53:39+00:00,MyJAKIM,"Thank God ybrs. Tuan Haji Ruslan Bin Said, TKPO JAKIM presented the 'Donation of the Musaadah Fund and to School' this afternoon at the Libang Ranau Sabah Hall. A total of 296 families received basic food assistance & amp; School Goods https://t.co/d3wxjvoilg",Kompleks Islam Putrajaya,thank god ybrs tuan haji ruslan bin said tkpo jakim presented donation musaadah fund school afternoon libang ranau sabah hall total family received basic food assistance amp school good
2023-03-16 05:17:08+00:00,Media_Selangor,"State Food Nutrition Assistance Initiatives 2,800 children this year https://t.co/IPNS8D9JGM",Shah Alam,state food nutrition assistance initiative child year
2023-03-16 07:36:36+00:00,PerakFood,"What else is this about the Rahmah menu?

This is a food port and water only RM1.

There is no help from the gomen, just initiatives from traders and the community.

Traders can finish sales
People can buy different types of food.

https://t.co/kpyowhthoc https://t.co/mxdasbtve8","Perak, Malaysia",else rahmah menu food port water rm help gomen initiative trader community trader finish sale people buy different type food
2023-03-27 08:11:19+00:00,Media_Selangor,"A total of 100 low -income residents (B40) in the Main Legislative Assembly (DUN) will receive the benefits of food assistance through the vending machine.

https://t.co/mpyteugjv1",Shah Alam,total low income resident b main legislative assembly dun receive benefit food assistance vending machine
2023-03-28 01:11:57+00:00,Media_Selangor,A single mother is grateful and relieved by the presence of a vending machine that provides food and personal care under her home. https://t.co/1yxhexob0g,Shah Alam,single mother grateful relieved presence vending machine provides food personal care home
2023-03-29 06:21:50+00:00,YBKMalaysia,#Skr2023 - The house that he and his family are living in is a contribution from the Selangor Zakat Board and also receives RM 500 monthly expenses and basic food - https://t.co/vcn5qodeao https://t.co/wa3lzn8zr3,"Petaling Jaya, Malaysia",house family living contribution selangor zakat board also receives rm monthly expense basic food
2023-03-29 07:01:46+00:00,DagangNews,"Coca-Cola, FoodPanda Collaborate on Food Assistance to those in need | TradingNews https://t.co/GBKSMONHQH",Kuala Lumpur Malaysia,cocacola foodpanda collaborate food assistance need tradingnews
2023-03-29 08:07:59+00:00,JapenSarawak,"Minister of Domestic Trade and Cost of Living, YB Datuk Seri Salahuddin Ayub said that as of yesterday, 26,150 Rahmah baskets had been distributed throughout Malaysia with the help of basic food donations from the Global Friendly Foundation (YGM).

#The Department of Description","Kuching, Sarawak",minister domestic trade cost living yb datuk seri salahuddin ayub said yesterday rahmah basket distributed throughout malaysia help basic food donation global friendly foundation ygm department description
2023-03-30 01:56:35+00:00,Fahri_Official,"Hello @shopeecare, I Seller Shopee Ask for a resolution of the order with a spxid032833481343 resi resi

Here the item is said to have failed to send, and returned to the seller. Loh while the goods sent were food that was definitely damaged when it was sent back to me.","Medan, Indonesia",hello seller shopee ask resolution order spxid resi resi item said failed send returned seller loh good sent food definitely damaged sent back
2023-03-30 02:59:13+00:00,Enviidii,"@Upungalimar responds to his mother's comments that he says he has never seen the camera.

Try;
Poto asked for help. The motorcycle told him to bring his favorite toys/food. Although the syulit is successful.",Bumi,responds mother comment say never seen camera try poto asked help motorcycle told bring favorite toysfood although syulit successful
2023-03-30 03:19:27+00:00,siswapas,"‼ ️ Due - Due 9 Nights, March 30, 2023

Find 50 recipients of the National Student Food Fund - UIAM Gombak

UIA Students are looking for 50 less fortunate UIAM students and/or needing the help of donating food in the form of dry food. https://t.co/dzp1cdlczu",,due due night march find recipient national student food fund uiam gombak uia student looking le fortunate uiam student andor needing help donating food form dry food
2023-03-30 03:23:13+00:00,Barac30987,@knpiharis lu if you want to give Palestina you to Palestine to help the war of food and clothing help and do not even koar koar to bury the dream of Indonesian youth pakkkk!,,lu want give palestina palestine help war food clothing help even koar koar bury dream indonesian youth pakkkk
2023-03-30 05:28:11+00:00,getbeu,"There are various ways to give a giving for example:

• Charging to a mosque or charity organization
• Provide food assistance to those in need
• Sponsor aid for orphans and families in trouble",,various way give giving example charging mosque charity organization provide food assistance need sponsor aid orphan family trouble
2023-03-30 06:07:51+00:00,thereportermy,"""I can get the RM300 JKM (Social Welfare) aid a month used to buy food and drinks.""

https://t.co/c8vehz1d2b https://t.co/skr0r4v2dl",Malaysia,get rm jkm social welfare aid month used buy food drink
2023-03-30 09:11:07+00:00,kumparan,"The assistance is in the form of drinking water, food and some of the community -based drugs. #newsupdate #update #news #text https://t.co/6bwpqvxijs",,assistance form drinking water food community based drug
2023-03-30 15:05:59+00:00,Juwaeny1,"Why in the fasting month of food? Isn't it ridiculous?
A Muslim works only to celebrate this month, even the lower economy gets help
That's the rotation of life for 1 year ...

٩ رمضان ١٤٤٤ ه‍",,fasting month food isnt ridiculous muslim work celebrate month even lower economy get help thats rotation life year
2023-03-30 15:32:49+00:00,PemdaKabJember,"Regent Jember Show PMT in the village

Regent Jember Hendy Siswanto has handed over PMT (supplements) to pregnant and Balita mothers in the village, Mumbulsari District, Thursday 30th March 2023.
https://t.co/g1y6cws7z2",Jember,regent jember show pmt village regent jember hendy siswanto handed pmt supplement pregnant balita mother village mumbulsari district thursday th march
