Datetime,Username,Text,Translated_Tweets,Cleaned_Tweets
2023-03-29,ace,Mampu masak kt rumah jah. Makanan luar mahal po nyepak https://t.co/eeskKiyaGI,Able to cook in Jah's house. Expensive Outdoor Foods Po Hang https://t.co/eeskkiyagi,able cook jahs house expensive outdoor food po hang
2023-03-28,Jeri,@adilaheiisha ni semua salah organizer bazaar letak harga tapak meniaga harga yahudi. Makanan semua mahal gila,@adilaheiisha This is all wrong organizer bazaar prices for Jewish prices. The food is all expensive crazy,wrong organizer bazaar price jewish price food expensive crazy
2023-03-26,apadila????????,"Tiap tahun baca kisah orang beli makanan bazar kata mahal lah, tak sedap lah, aku pun tak berapa nak ke bazar. Adalah sekali dua je dalam sebulan puasa tu. Tadi saja lah aku beli nasi kukus kasi chance, erm memang tak sedap pun. Sedih.","Every year read the story of people buying expensive bazaar foods, it's not good, I don't really want to go to the bazaar. Is once a month in the fast. Just before I bought steamed rice because of the chance, erm was not good. Sad.",every year read story people buying expensive bazaar food good dont really want go bazaar month fast bought steamed rice chance erm good sad
2023-03-26,????????????.??????????,Sebab tu aku tak pernah persoalkan harga makanan . Sebab aku tahu . Ni confirm tapak yang mahal . Bising kat peniaga biar peniaga bising kat tuan tanah . Ke macamana pengurusan diorang tak pasti lah . Sebab harga pasar malam biasa elok je tak mahal ?? https://t.co/QRDuRRIFo5,That's why I've never questioned the price of food. Because I know. This confirms expensive sites. Noisy traders let the traders noisy to the landlord. How management is not sure. Because the price of a normal night market is not expensive ?? https://t.co/qrdurrifo5,thats ive never questioned price food know confirms expensive site noisy trader let trader noisy landlord management sure price normal night market expensive
2023-03-26,Apai,Normal ke Roti John Cheese harga RM13? Am i missing something or makanan bazar memang mahal,Normal to John Cheese Bread Price RM13? Am I miss something or bazaar food is expensive,normal john cheese bread price rm miss something bazaar food expensive
2023-03-26,McLovin????,"Bukak reply penuh penyokong pakatan harapan marah awani, citer harga makanan mahal pun kena marah ?? https://t.co/p3JQdE8oms","Open a full reply to Pakatan Harapan supporters angry Awani, citer expensive food prices should be angry ?? https://t.co/p3jqde8oms",open full reply pakatan harapan supporter angry awani citer expensive food price angry
2023-03-26,Chef Jen,"Makanan kami mahal sgt ke? Kami retort, beli packaging gred tinggi, plastic tebal x lobos. Itu value kami, dgn bahan2 dan resepi sikitpun x shortcut.

Tp org igt kenaikan harga dia sorang je yang rasa, peniaga yg beli bahan mcm kami ni x perlu naik harga?","Our food is so expensive? We retort, buy high grade packaging, plastic thick x lobos. That's our value, with the ingredients and recipes of x shortcut.

But when the price increase is the one who thinks, the trader who bought our mcm material x needs to go up the price?",food expensive retort buy high grade packaging plastic thick x lobos thats value ingredient recipe x shortcut price increase one think trader bought mcm material x need go price
