Datetime,Username,Text,Location,Cleaned_Tweets
2023-01-12 08:10:16+00:00,hanisschokman,My parents house is undergoing somewhat like a renovation. So just now i pooped inside a newly painted toilet (which I didn’t realise it was newly painted) and now i feel like I’m having short breaths and my chest feels hot/burning 😭 should I be worried? Doctor doctor pls help,Kuala Lumpur City,parent house undergoing somewhat like renovation pooped inside newly painted toilet didnt realise newly painted feel like im short breath chest feel hotburning worried doctor doctor pls help
2023-01-12 05:58:22+00:00,ThiChA14264693,"@JacksonWang852 It's late, you haven't slept yet, I'm worried about you. 🇹🇭😊","Bangkok, Thailand",late havent slept yet im worried
2023-01-12 04:39:31+00:00,dortsmaria,"@Marika_M It’s normal for us to get cut off for a week or two at a time, we accept that. We also accept the immediate priority is Fitzroy! But I’m worried about the medium and long term situation. I guess we just have to be patient. It’s definitely unnerving.","Kununurra, Western Australia",normal u get cut week two time accept also accept immediate priority fitzroy im worried medium long term situation guess patient definitely unnerving
2023-01-12 03:14:27+00:00,aribahabdullah,Yall worried about this to parents who probably make them kids watch a bright screen with no filter whatsoever so they can scroll tiktok in peace https://t.co/2sja9VXpHy,,yall worried parent probably make kid watch bright screen filter whatsoever scroll tiktok peace
2023-01-11 23:20:09+00:00,KirstineJKrf,It's been raining for a month now back in our island and I worried the river might overflow. And the dam too.,Caratland,raining month back island worried river might overflow dam
2023-01-11 15:52:36+00:00,_midie,@syamean Power weh. Aku type merapu pon die boleh balas. Worried for our future 🤣,Upper East Side,power weh aku type merapu pon die boleh balas worried future
2023-01-10 15:59:59+00:00,naaadddiiirraaa,"“See, this is why I get worried when you leave my sight. This is why I get anxious when I can’t see where you are” STOPPPPP 💓❤️💛💖🤎💘🧡💞💛💖🖤💙💛🧡💚💖🧡💕💚💗💚🧡🤎❤️💚🖤💜🧡💖💜💕💛💓💚❣️💜💖🖤💛💓❤️❣️🤍💘❤️💚💖🧡🤍",,see get worried leave sight get anxious cant see stoppppp
2023-01-10 13:05:03+00:00,cynillic,"I really had to control myself from starting an issue with mom, when she told me to just move and work abroad with my sister because she's worried for my future here, when they voted for  🦆m. 🤦🏽🤦🏽🤦🏽","Baguio City, Philippines",really control starting issue mom told move work abroad sister shes worried future voted
2023-01-10 10:35:30+00:00,ace2hlnr,"*So-e telling Sejun how she fall and showing her scar to him*

Sejun: 
""this is why I get worried when you leave my sight""

Plssss i rrrrr love Kim Sejun 😭 #SinglesInferno2 #SinglesInferno2Ep10",neverland.,soe telling sejun fall showing scar sejun get worried leave sight plssss rrrrr love kim sejun
2023-01-10 03:09:05+00:00,TJRDBKK,@p2728818 @QuislingT @RyanWells1509 I'm not really worried about wealthy athletes and owners. I just want to see extremely competitive leagues where you have multiple teams competing for a championship and every team in the league has the opportunity to build a winner regardless of how wealthy their owners are,,im really worried wealthy athlete owner want see extremely competitive league multiple team competing championship every team league opportunity build winner regardless wealthy owner
2023-01-10 01:12:24+00:00,NoCar_Kevin,"Dubs made it through the storm of having Steph and Wiggins out. Currently tied for the 6th seed. 4th seed by the All Star Break. I, for one, was never worried because I’m rational","Bay Area, CA.",dub made storm steph wiggins currently tied th seed th seed star break one never worried im rational
2023-01-09 20:31:22+00:00,roseteee_ryu,And suddenly being worried can lead to arguments. 😀,"Bacoor, Calabarzon",suddenly worried lead argument
2023-01-09 14:49:10+00:00,ivanax_b,"toper never ever let me feel I should be jealous or worried, grabe yung assurance &amp; consistency since day one love na love kita!!!!🥺❤️ https://t.co/SPeAn4T8OL",,toper never ever let feel jealous worried grabe yung assurance amp consistency since day one love na love kita
2023-01-09 13:44:18+00:00,EuwanPascual,I’m rooting for our Queen Celeste it’s just that she’s not giving me that attitude and aura I was expecting her to give. Some even say na mala Pia ang atake nya but that’s Pia she’s Celeste. I’m worried na baka tayo ang masurprise. Wag naman sana. #MissUniverse2022 https://t.co/zaFNeltljX,Republic of the Philippines,im rooting queen celeste shes giving attitude aura expecting give even say na mala pia ang atake nya thats pia shes celeste im worried na baka tayo ang masurprise wag naman sana
2023-01-09 03:41:48+00:00,softwaredevsale,"@shovnr @ML_Philosophy Losing strategy, just make your rep so good they’re worried about theirs rather than you worried about yours","London, England",losing strategy make rep good theyre worried rather worried
2023-01-08 23:01:45+00:00,firnfactor,Early morning poopoo poopoo now i worried i late aiyo,weenie hut jr,early morning poopoo poopoo worried late aiyo
2023-01-08 22:01:26+00:00,johnnagiolagon,It's just that William and Kate have their own children. Aren't they worried the kids might suffer the same thing?,,william kate child arent worried kid might suffer thing
2023-01-08 17:29:49+00:00,najeeha_9,"Genuinely worried about her, what can I do to help to reduce heartache.",,genuinely worried help reduce heartache
2023-01-08 15:36:24+00:00,cyriellewong,Boyfie’s family had a mini reunion at their house and he insisted that we bring Macky. I was worried his mom wouldn’t be too keen with dogs but surprisingly she loved having Macky around! 🥰 Plus their relatives found him so cute they kept playing with him the whole time ❤️,"Cebu City, Central Visayas",boyfies family mini reunion house insisted bring macky worried mom wouldnt keen dog surprisingly loved macky around plus relative found cute kept playing whole time
2023-01-08 06:32:56+00:00,olvsbrn,"Last week pergantian tahun depan Duty Free IST makan Popeyes, with mixed feelings : excited, worried, all in one https://t.co/X2GBmwoZ0W","Berlin, Germany",last week pergantian tahun depan duty free ist makan popeyes mixed feeling excited worried one
2023-01-07 16:06:56+00:00,IndayGerald,Good day! @gmail Im asking for your assistance because last week I reset my phone. And now I cannot log in my old account. Now I create new gmail account. Im worried because my @YouTube channel are linked in my Old Gmail Account I hope it recover again. Thank,"National Capital Region, Repub",good day im asking assistance last week reset phone log old account create new gmail account im worried channel linked old gmail account hope recover thank
2023-01-07 13:04:21+00:00,JOONineteen,"I'm so worried now. Where is hobi? 😭😭
#jhopeatGDA #JHOPE #JHOPExGDA",🇵🇭,im worried hobi
2023-01-07 11:47:46+00:00,mimimia_pig,@FortPeatPHFC Starting to get worried about the PH ticket sale ..,,starting get worried ph ticket sale
2023-01-07 04:53:31+00:00,pi_grace,HAHAHAHHA Gu Nanting!! Were you that happy Cheng Xiao ended up cancelling her leave and not going to her mom’s place? Were you that worried she would quit the company? To the point where you didn’t get angry when one of the pilots made a mistake? 🤣🤣 #FlighttoYou,,hahahahha gu nanting happy cheng xiao ended cancelling leave going mom place worried would quit company point didnt get angry one pilot made mistake
2023-01-07 02:23:15+00:00,haerigi,he knows we’re really worried abt his health🥺,she/her,know really worried abt health
2023-01-07 00:43:48+00:00,DrTafuro,@thebradfordfile If controlling the United States is a giant game of capture the flag 🚩why are they so worried about house speaker 🤷🏻‍♂️,"Ho Chi Minh, Vietnam",controlling united state giant game capture flag worried house speaker
2023-01-06 23:03:52+00:00,silmi_luthfia,"It reminds me to myself ehhehe
Thanks for everyone who's worried about that, miss you all 😢🤗",,reminds ehhehe thanks everyone who worried miss
2023-01-06 23:01:19+00:00,motherchina,"Worried about #ChatGPT and #GPT3? Apparently, #GPTZero could be the answer to your prayers, at least for now https://t.co/E8OnKW1XVa",Taiwan,worried apparently could answer prayer least
2023-01-06 22:10:05+00:00,AfiffAizad,"De Gea mistakes isnt something abnormal. He was split sec away from the game. For me its not s'thing that should be worried abt. Normal, for his standard it was unacceptable, but mistakes can be happen, it just when?where?why? Thats it. Most important how he recover aftr this.","Bandar Kuala Lumpur, Wilayah P",de gea mistake isnt something abnormal split sec away game sthing worried abt normal standard unacceptable mistake happen whenwherewhy thats important recover aftr
2023-01-06 15:27:35+00:00,imrickzyyy,Ps. My mom actually told me earlier that what if I'll never get married because my idols made my standard high and actually look for someone who's handsome and talented like them 😭 i just laughed but deep inside- yeah I'm worried too.,"Makati City, National Capital ",p mom actually told earlier ill never get married idol made standard high actually look someone who handsome talented like laughed deep inside yeah im worried
2023-01-06 15:06:59+00:00,DnishIdlan,It keeps raining heavily at night and kinds got me worried for tomorrow's camping,,keep raining heavily night kind got worried tomorrow camping
2023-01-06 13:51:17+00:00,jMez08,Now I’m worried and I’m missing my mom even though it isn’t obvious #MySchoolPresidentEP5,Philippines,im worried im missing mom even though isnt obvious
2023-01-06 10:24:15+00:00,0TempesT0_,"@RoyalKimmich @iMiaSanMia The game is in 14th February bro. Still he has more than a month, He will be back in 7-10 days after covid. So why r u worried?","Dhaka, Bangladesh",game th february bro still month back day covid r u worried
2023-01-06 10:06:49+00:00,KhaosodEnglish,"A sign at a local shop in #Bangkok promoting Chinese New Year, or rather its goods. It's less than 48 hrs before Chinese tourists can travel to Thailand without restrictions after nearly 3 yrs.
Are u glad, anxious or worried? What say u? 
(Photo by @PravitR) #Thailand  #China #KE https://t.co/jCE0QnY3mT","Bangkok, Thailand",sign local shop promoting chinese new year rather good le hr chinese tourist travel thailand without restriction nearly yr u glad anxious worried say u photo
2023-01-06 04:53:34+00:00,Nooninoona1,"I think I am most looking forward to what Jimin will do in Chapter 2. Tbh, he was the one I was worried about during festa because he seemed to be the most affected by what they were going through. I’m proud he is stepping out on his own and shining as we know he could💜 https://t.co/NnXqKjbfqi",Singapore,think looking forward jimin chapter tbh one worried festa seemed affected going im proud stepping shining know could
2023-01-06 01:32:00+00:00,mary_yourjoy,"Frustrated, anxious, worried",Republic of the Philippines,frustrated anxious worried
2023-01-05 17:17:45+00:00,CasuntinganWjv,"Rainy days? Looking for a place to spend a burning love?
We Wjv Inn Casuntingan is here to serve you. 

We OFFER a very affordable ROOM RATES. 
We have a REGULAR ROOMS and DELUXE ROOMS

Worried about TIME EXTENSION? 
We only give Rate that is very affordable. https://t.co/NdCX6BQbyo","Mandaue City, Central Visayas",rainy day looking place spend burning love wjv inn casuntingan serve offer affordable room rate regular room deluxe room worried time extension give rate affordable
2023-01-05 10:38:49+00:00,MKhairilRedza,Not everyone worried about my sleep pattern and my once in a day meal’s potion. 🤣🤣🤣,"Lahad Datu, Sabah",everyone worried sleep pattern day meal potion
2023-01-05 10:33:49+00:00,joansmariecc_,I just want to let her know that I’m worried sick and wanted to know if she’s doing fine.,Republic of the Philippines,want let know im worried sick wanted know shes fine
2023-01-05 03:14:04+00:00,maru_seiya,"@st_meowmeow I am sorry to learn that there are interyors who were victimized by them. I was worried that if I wait for their procedure, it will take months, or worst, years! That is why I initiated a dispute claim thru my cc bank.","Quezon City, Philippines",sorry learn interyors victimized worried wait procedure take month worst year initiated dispute claim thru cc bank
2023-01-04 18:40:07+00:00,catsnekowl,@Omgitsbizarre Same im more worried about Boishakh,,im worried boishakh
2023-01-04 13:03:14+00:00,ninyaangelica,"While i’m having my break earlier, sobrang uneasy ng pakiramdam ko, very much uncomfortable, little bit worried and anxious - around 1:30 pm one our student came tapos nag papapirma siya ng Form for College Application and in shock, she’s holding a notebook with a cover","San Pablo City, Calabarzon",im break earlier sobrang uneasy ng pakiramdam ko much uncomfortable little bit worried anxious around pm one student came tapos nag papapirma siya ng form college application shock shes holding notebook cover
2023-01-04 11:49:01+00:00,geraldine_Chua,Thinking of being free from work tmr and it just makes me feel better lol but kinda worried for my checkup when my doctor says i can't be discharged yet but it has been 8 years 😟,싱카폴,thinking free work tmr make feel better lol kinda worried checkup doctor say cant discharged yet year
2023-01-04 02:49:47+00:00,Bobaloo2008,@Troyel1968 I think we're all worried now. The truth is getting out.,,think worried truth getting
2023-01-03 22:16:55+00:00,zntmsk,I was so worried that I wouldn't be able to get up early but fate spoke differently,"East Java, Indonesia",worried wouldnt able get early fate spoke differently
2023-01-03 19:12:35+00:00,nursebienny,Worried much 😟,"Makati City, National Capital Region",worried much
2023-01-03 14:30:19+00:00,Grandmoffjonkin,@Deancoo92619645 @DiggyDog71 @darrengrimes_ No that’s not what we’re worried about. We’re worried that already our lives are bad as the majority in our own country being hen pecked and talked down to and having our needs out last in favor of non natives. . So we’re asking how much farther will it go once we’re the minority,,thats worried worried already life bad majority country hen pecked talked need last favor non native asking much farther go minority
2023-01-03 11:24:27+00:00,LizinBali,"@annieMeads84 @1goodtern Well I had a mild case, it was over in a week and lighter than a cold. But now I’m very worried about the research. I’m going to the hospital next week for a chest X-ray and MRI.","Bali, Indonesia",well mild case week lighter cold im worried research im going hospital next week chest xray mri
2023-01-03 09:11:55+00:00,audiovisualaidz,"Heading to an SM, so pulled out the 3M Aura. I far prefer the fit of the VFlex, but that duckbill is such a boner-killer. Kinda worried about the fit of the Aura on the bridge of my nose. https://t.co/kp113DvsFP",,heading sm pulled aura far prefer fit vflex duckbill bonerkiller kinda worried fit aura bridge nose
2023-01-03 04:48:32+00:00,SMQotaddah,"@AdamSafOne @bitcoinmalaya That’s why we are worried about China now, with 1.4 billion people, the possibility of a new variant emerging is exceedingly worrying. 

Along with unrestricted global travel, it’s a ticking time bomb.

We were worried about XBB a few months back already.",Jordan,thats worried china billion people possibility new variant emerging exceedingly worrying along unrestricted global travel ticking time bomb worried xbb month back already
2023-01-03 03:39:33+00:00,kx_zee,"@BkcSports I also think it’s kind of bad taste to postpone the game for so long and keep running ads while cutting back to the commentators. Just kill the broadcast. Feels like an ad revenue cash grab. Like we are worried about someone’s life, not Popeyes chicken","Bangkok, Thailand",also think kind bad taste postpone game long keep running ad cutting back commentator kill broadcast feel like ad revenue cash grab like worried someone life popeyes chicken
2023-01-02 13:30:16+00:00,nopitachyn,"dear mom, I'm just worried. I am afraid that something that happened before will happen again, please understand. I know I'm stubborn but believe me I love you endlessly","Bandung, Indonesia",dear mom im worried afraid something happened happen please understand know im stubborn believe love endlessly
2023-01-02 11:11:26+00:00,jim0664,"@realTuckFrumper So now your worried about your own ass since the recent political rulings of the court are under attack!  I say, give you no more security than anyone else!  Why should the American@people shoulder your security bill when you are acting on behalf of a few!","Jakarta Capital Region, Indonesia",worried as since recent political ruling court attack say give security anyone else american shoulder security bill acting behalf
2023-01-02 10:52:43+00:00,youraltanessmd,Mej worried for our flight next week.😬,"Sogod, Eastern Visayas",mej worried flight next week
2023-01-02 08:15:47+00:00,NorainKasban,@EWaraha Worried about you. Please go clinic for checkup. Love you @EWaraha my fav artist🤍🤍,Singapore,worried please go clinic checkup love fav artist
2023-01-02 07:09:58+00:00,StephaninBKK,@georgie_thai @KevinCmhasia Good analogy.  It all started this time 2020 so people are worried and cautious.  Myself I’m not giving it much thought and am glad they finally opening up and getting on with life again.,Bangkok,good analogy started time people worried cautious im giving much thought glad finally opening getting life
2023-01-02 05:42:16+00:00,SabrinaZalani,"Knowing myself, i'd be hunting for a new pillow or plushie soon. Im now worried thinking of going to sleep without it tonight.",Jupiter,knowing id hunting new pillow plushie soon im worried thinking going sleep without tonight
2023-01-02 05:17:20+00:00,dendenmyoui,One of my HS friends with her gf visited me today cause she’s really worried to my fam. Appreciated the act of this friend of mine.,Mina's mole,one h friend gf visited today cause shes really worried fam appreciated act friend mine
2023-01-01 22:03:50+00:00,dannyprasetya,"I know He has to focus on the games he's coaching. Can't be worried about things out of his control.

But head coach needs to know playoff variables.","Jakarta Capital Region, Indone",know focus game he coaching cant worried thing control head coach need know playoff variable
2023-01-01 17:13:21+00:00,gabdorian_,"We ought to feel “things” - plural - not just happy nor sad nor angry nor disgusted nor worried. We ought to feel something. I think, It is Being Fake when you stop feeling any of these. And that’s just totally - unacceptable and dangerous.",Quezon City,ought feel thing plural happy sad angry disgusted worried ought feel something think fake stop feeling thats totally unacceptable dangerous
2023-01-01 12:31:43+00:00,MaxHadid29,Carlos is both worried for Tisha and sick of her lies. His direct line of questioning was hard to watch. He was detective in a previous life #LAMH #LAMHReunion,"Selangor, Malaysia",carlos worried tisha sick lie direct line questioning hard watch detective previous life
2023-01-01 07:24:50+00:00,LoudDunkMummy,"Yeah, those who are worried about Dunk gonnabe bigger than Joong.. look at their neck sizes 🤣🤣🤣 it's obvious who's bigger",,yeah worried dunk gonnabe bigger joong look neck size obvious who bigger
2023-01-01 00:19:23+00:00,measaura,"While Maybank denied about the data breach, Unifi individually sent an email to me about this issue. Should I be worried? https://t.co/vDnhyPzgu9",From Earthland,maybank denied data breach unifi individually sent email issue worried
2022-12-31 12:31:30+00:00,aniliaz,Carat worried about Mingyu too 😭😭 Thx Hanie 🫶,Kat rumah,carat worried mingyu thx hanie
2022-12-31 11:32:26+00:00,cckkpr,Not too worried over China covid. The test results of 2 airplanes passengers at Milan airport indicate the less potent Omicron virus n without symptoms. For safety sake advisable to put on mask where necessary.,"Kinta, Perak",worried china covid test result airplane passenger milan airport indicate le potent omicron virus n without symptom safety sake advisable put mask necessary
2022-12-31 04:09:33+00:00,jessayalung,worried. hays Lord wag naman po please 🙏,,worried hay lord wag naman po please
2022-12-31 01:02:10+00:00,vknsvrn,"@_afqhjnd Wuhoo 🎉 🎊 to be in a place where u don’t get to feel worried, upset or frustrated is really a blessing. There could be so much challenge there but not once u will feel like quitting, then u know that’s the place for u stay for a lil longer 😊 wishing u all the best there ika!",Johor MY,wuhoo place u dont get feel worried upset frustrated really blessing could much challenge u feel like quitting u know thats place u stay lil longer wishing u best ika
2022-12-31 00:40:25+00:00,1n1tcool,It’s a great day! I woke up from a dream 💭💤 The8 🐸 in it… Maybe I was too worried he got sick that I was taking care of him like a baby.. 🤭😊,,great day woke dream maybe worried got sick taking care like baby
2022-12-30 22:57:45+00:00,oliverstedman,@jeremyideal @daviddownie17 Some substandard footballers bought on a shoe string budget when we were worried about FFP implications or late in the window,"West Midlands, England",substandard footballer bought shoe string budget worried ffp implication late window
2022-12-30 22:41:57+00:00,iliyanaili,"Call me selfish but im super worried for 2023 once China’s borders are open again, we WILL wave after wave and our healthcare will be burdened again. Can we pls have at least ART tests before they cross our borders pls😭😭",Singapore,call selfish im super worried china border open wave wave healthcare burdened pls least art test cross border pls
2022-12-30 15:37:21+00:00,LoudDunkMummy,"So happy to see you and Joong today before 2022 ended, we will be here on 2023 to cheer u guys up 🤗. If possible, do give us an update when u get home safely because we're all worried 🥲.

#Lotusscountdown2023
#จุงอาเชน #dunknatachai",,happy see joong today ended cheer u guy possible give u update u get home safely worried
2022-12-30 09:33:18+00:00,khayrawknd,"i showed ibu the scars i carved on my hand and she didn't scold me at all. 
she didnt make me feel stupid. 
even though in her heart, she was worried about me.
that's why i love her so much.",,showed ibu scar carved hand didnt scold didnt make feel stupid even though heart worried thats love much
2022-12-30 09:25:33+00:00,rrismaeka,"I'm getting worried of myself, I was literally ate half of my birthday cake which is chocolate cake or it was brownies cake idek🙃 I don't like cake and chocolate",mikrokosmos,im getting worried literally ate half birthday cake chocolate cake brownie cake idek dont like cake chocolate
2022-12-30 07:57:10+00:00,LoudDunkMummy,And remember how Joong was worried that Dunk would dislike him being fussy (he probably thinks he can be a little bossy) but i think he knows now that Dunk doesn't mind. I think Joong is a detailed person too so i guess he even planned their accessories to match,,remember joong worried dunk would dislike fussy probably think little bossy think know dunk doesnt mind think joong detailed person guess even planned accessory match
2022-12-30 01:14:52+00:00,ridhomufdly,"kun faya kun, you're worried He didn't answer you, you're thinking He's not gonna answer you, and all the time He's been planning perfectly for you. Think good of Allah and keep making Dua, His Kun changes everything.","Yogyakarta, Indonesia",kun faya kun youre worried didnt answer youre thinking he gon na answer time he planning perfectly think good allah keep making dua kun change everything
2022-12-29 18:30:18+00:00,LeePop1975,@MaffHKR @KSI @LoganPaul @AldiUK To think people are worried about immigration. I’m more worried about our kids needing this shit and people pampering to &amp; fighting each other to get it. Honest we are like living in some alternative reality!!,"Hull, England",think people worried immigration im worried kid needing shit people pampering amp fighting get honest like living alternative reality
2022-12-29 17:35:22+00:00,kyeomisyu,THEIR ENERGY LEVEL'S BEYOND EVERYTHING😭😭😭😭 IM PROUD BUT ALSO WORRIED😭💔 u've worked hard my loml:') @pledis_17,,energy level beyond everything im proud also worried uve worked hard loml
2022-12-29 13:04:22+00:00,GL1962,"@Reuters Not every EU countrybis run by Fascists and Nazis... Wow. Good to know. I was getting worried considering they fund organizations in Ukraine that they themselves, said were Nazi before February....","Bangkok, Thailand",every eu countrybis run fascist nazi wow good know getting worried considering fund organization ukraine said nazi february
2022-12-29 12:29:52+00:00,chimmycookyyyy,the “im worried but I’m still teasing you” reaction lol HAHAHAHA I hope joshua is okay huhu 🥺,Magic Shop,im worried im still teasing reaction lol hahahaha hope joshua okay huhu
2022-12-29 10:45:59+00:00,raynocchio,fubu so worried 😹,upd,fubu worried
2022-12-29 06:41:00+00:00,Weaver____369,I just realized that lately I am so easily pleased. Should I be worried? Am i being too passive or on the extreme end of none attachment state of mind?,"Ho Chi Minh, Vietnam",realized lately easily pleased worried passive extreme end none attachment state mind
