Datetime,Username,Text,Location,Cleaned_Tweets
2023-03-30 23:55:01+00:00,firdyfire,"Industry players worried about Energy Commission chief’s ‘other job’

https://t.co/troihOFab9",Malaysia,industry player worried energy commission chief job
2023-03-30 23:49:23+00:00,angel19971102,"@setox8 I love this so much😭😭😭
Clark must've always been worried about Bruce and dreaded about losing him...
love the angst and how Bruce comfort Clark without questioning or doubting anything.",Taiwan,love much clark mustve always worried bruce dreaded losing love angst bruce comfort clark without questioning doubting anything
2023-03-30 23:45:13+00:00,Charrlygirl,@HillaryMonahan I’m worried. For the prosecution team and their families. I’m also worried that a frenzy is about to be whipped up.,MA,im worried prosecution team family im also worried frenzy whipped
2023-03-30 23:29:47+00:00,_AdamBomb95,I literally heard like 4 airplanes fly overhead in the past 20 minutes. All close as fuck too. Not sure if I should be worried.,CA,literally heard like airplane fly overhead past minute close fuck sure worried
2023-03-30 23:17:19+00:00,linusesq,should we be worried about the @phillies?  meanwhile the Jays/Cards trading big shots,Philly metro,worried meanwhile jayscards trading big shot
2023-03-30 23:08:45+00:00,AdrianE04275411,What's so wrong with the New Day passing out boxes of Cinnamoji Toast Crunch at #Wrestlemania? I'd be more worried about the fact that it's not a special edition Booty-O's box.,Somewhere in GA,whats wrong new day passing box cinnamoji toast crunch id worried fact special edition bootyos box
2023-03-30 22:48:45+00:00,AMGglobal64,@CollinRugg I find it ironically hilarious that it only takes about 6 Alpha males to handle a roomful of angry trans mob folk. This is why most of us aren't seriously worried about any threats from the Left.,CA,find ironically hilarious take alpha male handle roomful angry trans mob folk u arent seriously worried threat left
2023-03-30 22:44:14+00:00,jakolenn,Husband is being extra caring these days &amp; I love it 💕he seems to be worried if that annoys me but ai said I like it,sabah,husband extra caring day amp love seems worried annoys ai said like
2023-03-30 22:21:08+00:00,thespicexqueen,America is full of domestic terrorists and everybody worried about countries halfway around the damn world,CA.,america full domestic terrorist everybody worried country halfway around damn world
2023-03-30 21:48:12+00:00,musicienmorose,"This time, Lawrence's patience is wearing thin; and additionally, he's worried someone might walk in and wonder who's messing with the piano.

He moves forward urgently to grab Quincy's arm as soon as he sees him go in for more key smashing.

   ""Why do you behave like a child?""",x,time lawrence patience wearing thin additionally he worried someone might walk wonder who messing piano move forward urgently grab quincy arm soon see go key smashing behave like child
2023-03-30 21:43:26+00:00,HassanMahmood_,@mockingjay_45 Now I'm worried why it took them so much time to realize that,Lahore-Islamabad ,im worried took much time realize
2023-03-30 21:27:12+00:00,smallyang007,"If life cheats you，don't be disappointed and worried.Calmness is needed in melancholy days    #DiorFall23xMileApo 

MILEAPO IN MUMBAI",Thailand,life cheat youdont disappointed worriedcalmness needed melancholy day mileapo mumbai
2023-03-30 21:02:41+00:00,mileapo19851121,"There are many people who get off halfway, you don't have to be worried,    

MILEAPO IN MUMBAI                                                           #DiorFall23xMileApo @milephakphum @Nnattawin1",ประเทศไทย,many people get halfway dont worried mileapo mumbai
2023-03-30 20:52:49+00:00,miiraaRaa,@ApeOnArbitrum yes.  I was worried when your old account disappeared.,Jawa Tengah,yes worried old account disappeared
2023-03-30 20:36:48+00:00,eklaieklaii,"We should all be worried about this. @NepalPoliceHQ, please take them into control if this is in Nepal. If this continues, Nepal will become just like India.",Nepal,worried please take control nepal continues nepal become like india
2023-03-30 20:34:23+00:00,JieMALv,"I st'ill like myselt. I am not disappointed. worried, moved or disappointed.  

@Nnattawin1   @milephakphum #DiorFall23xMileApo",กรุงเทพมหานคร,still like myselt disappointed worried moved disappointed
2023-03-30 20:18:31+00:00,SalmanNaseer,@4eyedRaven @batttman12 Man is depressed and I'm worried about him.,Islamabad,man depressed im worried
2023-03-30 19:53:52+00:00,mileapo19851121,"What is lost is always beautiful, and what is not obtained is always worried.    

MILEAPO IN MUMBAI                                                           #DiorFall23xMileApo @milephakphum @Nnattawin1",ประเทศไทย,lost always beautiful obtained always worried mileapo mumbai
2023-03-30 19:25:53+00:00,IAm_DylanJames,"Y’all rly out here worried and comparing urself to ppl that do not even have an ounce of the values, integrity or self belief that u got and that’s where ur fucked up bc ur not recognizing ur own worth or value so ur getting in ur own way and throwing urself off, acting in ways…","Bali, Indonesia",yall rly worried comparing urself ppl even ounce value integrity self belief u got thats ur fucked bc ur recognizing ur worth value ur getting ur way throwing urself acting way
2023-03-30 19:17:53+00:00,ShahajadaShahP,"Assange has been confined in Belmarsh, a category A prison, in London since April 2019. We, the Bangladeshi alongside other south asian countries  people are also very worried about #JulianAssange. We are also gravely concerned.

#FreeAssangeNOW","Dhaka, Bangladesh",assange confined belmarsh category prison london since april bangladeshi alongside south asian country people also worried also gravely concerned
2023-03-30 18:39:40+00:00,NewAgeBDcom,Editors’ Council worried https://t.co/i0orHyi0Xd,Dhaka,editor council worried
2023-03-30 18:38:37+00:00,SyedAliRizviOf1,"The major underlying cause of increasing poverty is the lack of Basic Human Rights. The dilemma is that influentials ensure people stay worried about bread rather than striving for rights that can solve all social problems.
#Supreme_Court_Of_Pakistan
 #PakistanEconomicCrisis https://t.co/KV4LNqxTmT",Islamabad,major underlying cause increasing poverty lack basic human right dilemma influentials ensure people stay worried bread rather striving right solve social problem
2023-03-30 18:29:21+00:00,Hangvn,"Each ho #推特账号 ur they grew more worried 
#推特代发 #推特群发 https://t.co/sMe9aNdrFA",Vietnam,ho ur grew worried
2023-03-30 18:24:35+00:00,Nowthisisall,"@rsrchaf I was thinking if this guy is behaving so aggressively, then how would he treat the actors as his students?? I’m so worried about them now😂!! Still he literally give his efforts to the shitty trolls!!","London, England",thinking guy behaving aggressively would treat actor student im worried still literally give effort shitty troll
2023-03-30 18:07:43+00:00,kavin9587,@Dave25720402 Why are you worried so much when the owner of this account is not concerned about it?,Singapore,worried much owner account concerned
2023-03-30 17:29:26+00:00,Filpped_Mileapo,"Every day beats for you, every moment is touched by you, every second is worried about you. It's nice to have you :D:

#DiorFall23xMileApo   @milephakphum  @Nnattawin1",ประเทศไทย,every day beat every moment touched every second worried nice
2023-03-30 17:21:04+00:00,Ravithirann,"@thatgurlahal You're assuming things, crying, and ovethinking that makes me feel so bad and worried abt you. 😪💔",Malaysia,youre assuming thing cry ovethinking make feel bad worried abt
2023-03-30 17:20:13+00:00,SoleiLauren,going on a birthday trip ur girl paid for &amp; still being worried about wtf i'm doing and making sure i know is crazyyyyy, Catch me if you can ,going birthday trip ur girl paid amp still worried wtf im making sure know crazyyyyy
2023-03-30 17:13:32+00:00,Mileapo66,"14. The reason why we are worried is that our memory is too good. What should be remembered and what should not be remembered will remain in our memory.
#DiorFall23xMileApo",ประเทศไทย,reason worried memory good remembered remembered remain memory
2023-03-30 17:07:12+00:00,Wenzhou137666,":D: Thise is only one name in the world, and it makes me so worried, like an invisible thread, one end firmly tied to the tip of my heart, and the othis end in your hand :D:

#DiorFall23xMileApo @Nnattawin1 @MilePhakpum",Thailand,thise one name world make worried like invisible thread one end firmly tied tip heart othis end hand
2023-03-30 17:01:16+00:00,Lossblueberr,"@KingXavier28 I'm actually fine, but I'm worried about my school work recently",indonesia,im actually fine im worried school work recently
2023-03-30 16:50:38+00:00,tkey_wm,"please concern about our nong si say na~ he worried about all of the fans too, every people need personal space including them as an artist🙏",Indonesia,please concern nong si say na worried fan every people need personal space including artist
2023-03-30 16:32:46+00:00,pPrince54,All my friends are either engaged or married and all I’m worried about is how can I get another dog,CA,friend either engaged married im worried get another dog
2023-03-30 16:31:53+00:00,hanbinhours,its the fact that gyuvin was consistently being 6th over the last weeks and literally dropped 10 spots outta nowhere I'm so worried for matthew I'm not even kidding,Malaysia,fact gyuvin consistently th last week literally dropped spot outta nowhere im worried matthew im even kidding
2023-03-30 16:25:35+00:00,z1haobabe,“Someone call zihao (probably Manager or staff) but he won’t go out bcs he’s worried for Ollie”,Malaysia,someone call zihao probably manager staff wont go bcs he worried ollie
2023-03-30 16:19:40+00:00,Kenma66,@GianneSkyT Initially I was worried for Jodi because she would always say she hates competitive but seeing her grind with the team is so amazing to see!,"Dhaka, Bangladesh",initially worried jodi would always say hate competitive seeing grind team amazing see
2023-03-30 16:19:16+00:00,mmary4u,I ain't worried ‘bout it right now 🎶🎵,Makati City,aint worried bout right
2023-03-30 16:17:11+00:00,marinellelotado,"I was worried if Tu, Bright, Prim, Win, Dew and Nani had the time to talk with each other during the outing but seeing the photos of them together in one table on the first day proves that they have real friendship outside the camera. 
The best moments doesn't need to be shared🫶",Republic of the Philippines,worried tu bright prim win dew nani time talk outing seeing photo together one table first day prof real friendship outside camera best moment doesnt need shared
2023-03-30 16:09:40+00:00,The_PattayaNews,"#Phuket officials say black water on #Patong Beach is just plankton bloom and nothing to be worried about.

https://t.co/2wT89zmFHV https://t.co/D4ySHdw4kd","Mueang Pattaya, Thailand",official say black water beach plankton bloom nothing worried
2023-03-30 15:57:37+00:00,BullionStar,Will Deutsche Bank be the Next to Fall? Worried Investors Are Already Turning to Gold https://t.co/PplgIeaCU7 via @Benzinga,Singapore,deutsche bank next fall worried investor already turning gold via
2023-03-30 15:55:40+00:00,raraxoxx,He said worrying about someone sleep is something u can't say unless you really love them. He know that worried means love🥹🫶,indonesia,said worrying someone sleep something u cant say unless really love know worried mean love
2023-03-30 15:42:51+00:00,wulimileapo,"14. The reason why we are worried is that our memory is too good. What should be remembered and what should not be remembered will remain in our memory.
MILE FOR DIOR 

#DiorFall23xMileApo 
@milephakphum",Thailand,reason worried memory good remembered remembered remain memory mile dior
2023-03-30 15:42:34+00:00,TurncoatD,@ggreenwald I don’t understand the sentiment in the first place. Why would anyone want to ban it? Just don’t use it if you are worried.,CA,dont understand sentiment first place would anyone want ban dont use worried
2023-03-30 15:30:01+00:00,tribunephl,"Some people are worried that Mindanao might be forgotten since the president now is from Northern Luzon.

Full story: https://t.co/hXEhEl5rrp",Makati City,people worried mindanao might forgotten since president northern luzon full story
2023-03-30 15:29:35+00:00,wendychen0910,"14. The reason why we are worried is that our memory is too good. What should be remembered and what should not be remembered will remain in our memory.#DiorFall23xMileApo In Mumbai
@milephakphum
@Nnattawin1",Thailand,reason worried memory good remembered remembered remain memory mumbai
2023-03-30 15:23:08+00:00,QueenNS9595,"I'm that girl who will double, triple and quadruple text you when you're off the radar coz I'm worried about your safety. 

I'm that girl who'll noticed every slight changes in you coz I read pattern. 

I'm that girl that will annoy you. But only because I love getting","Johor Bahru, Johor",im girl double triple quadruple text youre radar coz im worried safety im girl wholl noticed every slight change coz read pattern im girl annoy love getting
2023-03-30 15:21:00+00:00,BabyRaccoon91,It didn't go anywhere really interesting concerning AIs specifically. I'm worried about the effect of ubiquitous AI in the future on our cognitive ability. (2),"Misamis Oriental, Philippines ",didnt go anywhere really interesting concerning ai specifically im worried effect ubiquitous ai future cognitive ability
2023-03-30 15:11:06+00:00,MyLeeJongSuk2,"""I'm standing in front of the river where I have to go, but I'm not worried because everyone is with me. Thank you for giving me so much time."" ~LeeJongSuk

#Jongsuk13thDebut
#13YearsOfLeeJongSuk
📸Pit-a-Pat Seoul 2018 https://t.co/NXclT9clox",Republic of the Philippines,im standing front river go im worried everyone thank giving much time leejongsuk pitapat seoul
2023-03-30 14:55:27+00:00,build_army,"@bbbmylov Yes I have been informed right now and I will delete it 😅 Happy they’re doing it like that, it had us worried!! 💙🙏🏻",Thailand,yes informed right delete happy theyre like u worried
2023-03-30 14:54:02+00:00,amoua239,"Inquisitive ( curious , eager to knowledge). Enormous( huge ,very big ). Apprehensive(worried about something). On guard ( prepared to protect ).",深圳,inquisitive curious eager knowledge enormous huge big apprehensiveworried something guard prepared protect
2023-03-30 14:33:38+00:00,AppleViriya,"@curcunist Woww...That's a really long vacation.  I'm glad she will have a good rest and spend more time with family and friends.  However, I'm not worried that we will not see her a long time.  As a workaholic that she is, I'm sure she will get bored after 3 months. 😉",Bangkok,wowwthats really long vacation im glad good rest spend time family friend however im worried see long time workaholic im sure get bored month
2023-03-30 14:33:19+00:00,taeraeyang,"Im already crying coz im so worried abt taerae's ranking eventho idk he will out from top9 or nah,u dont understand😔",Malaysia,im already cry coz im worried abt taeraes ranking eventho idk top nahu dont understand
2023-03-30 14:20:11+00:00,MirzaHSW,The ranking switch so much after 3 pick vote..i guess it depend on how strong 1 pick is...i'm worried abt jongwoo feel like he's 1 pick is not that strong..afraid that his raking drop😭,"Sarawak, Malaysia",ranking switch much pick votei guess depend strong pick isim worried abt jongwoo feel like he pick strongafraid raking drop
2023-03-30 14:18:32+00:00,TaylorOgan,"@metaspaceperson Proof? Do you think I’m worried about what I say? Like, at all?","Shenzhen, China",proof think im worried say like
2023-03-30 14:18:27+00:00,sikenit_d,I am happy for Jeonghyun but worried for Gyuvin 😫 #boysplanet,Singapore,happy jeonghyun worried gyuvin
2023-03-30 14:11:11+00:00,kammieeekam,Y’all b worried way too much bout other people tf.,St james,yall b worried way much bout people tf
2023-03-30 14:08:36+00:00,PearlNoynay,"""As soon as I walked into a room, I worried that people might judge me."" This is the very first thought I have when I entered the class in the first day of school🫢",Philippines!,soon walked room worried people might judge first thought entered class first day school
2023-03-30 13:33:04+00:00,FlipsterNFT,"Finally, @OakParadiseNFT lacked some consistency😅! Not worried at all. Finally similar yields as others.

@degenfatcats have an upcoming event which should help volume. Still using @DCF_microshares and @nftrixnet new site (https://t.co/dVtClBA5Lh) to stay up to date on DFC! https://t.co/xGoPv1YS6L",Solana,finally lacked consistency worried finally similar yield others upcoming event help volume still using new site stay date dfc
2023-03-30 13:21:38+00:00,sugarcheenee,"+ Po always come to talk, put his hands on dancer crew's shoulder to encourage everytime. And finally we met each other in WTF . First i m so worried that will Po has time for dance practice?, Could Po dance ?, Would Po be too tried ? 555 +
(2)
#Nnattawin @Nnattawin1",ประเทศไทย,po always come talk put hand dancer crew shoulder encourage everytime finally met wtf first worried po time dance practice could po dance would po tried
2023-03-30 13:15:22+00:00,CrazyNatedog,@sl1ghtlyf1shy @CutitupC @HumansNoContext It’s for people worried about being attacked by an angry mob,CA,people worried attacked angry mob
2023-03-30 12:54:02+00:00,FionaPatton10,"@Lias89733971 My daughter introduced her 4month old kitten to sardines just this evening. She was worried about storing leftovers 🤣
I made tuna pasta @ Mum's &amp; it's still weird I can open a tin without immediately having to guard it. Mum has no pets &amp; my last one crossed the bridge in 2020 😔",Victoria,daughter introduced month old kitten sardine evening worried storing leftover made tuna pasta mum amp still weird open tin without immediately guard mum pet amp last one crossed bridge
2023-03-30 12:46:40+00:00,djbozoo,"I'm a little less worried 'bout life with you 

PROMise24EVER WithDONBELLE

#AMarBELLEousMagicalNight
#WonDONNYrousPromNight https://t.co/sc2rP4CrLg",Republic of the Philippines,im little le worried bout life promiseever withdonbelle
2023-03-30 12:40:50+00:00,anjirated,"When all of you were talking about whether she'll walk alone or with a pair, I was worried if she couldn't make it to the prom or not. It's a great chance for her to have the spotlight she deserves and I'm glad she made it!

ANJI MANINGNING NA BITUIN
#AnjiSalvacion @anjisalvacion",Republic of the Philippines,talking whether shell walk alone pair worried couldnt make prom great chance spotlight deserves im glad made anji maningning na bituin
2023-03-30 12:37:07+00:00,dnicholls74,"@Beno_ldn It’s political. They are worried about the attention and fan base if he gets out. This is wrong though. He will come out only if very ill, like Reg Kray. Not even an open prison, so he will be rejected again.",Singapore,political worried attention fan base get wrong though come ill like reg kray even open prison rejected
2023-03-30 12:30:41+00:00,dnicholls74,"@BBCBreaking They should at least move him to an open prison to assess hi, for the next appeal. This is political, they are worried about the fan clubs. They will let him out when terminally ill like Reg Krause.",Singapore,least move open prison ass hi next appeal political worried fan club let terminally ill like reg krause
2023-03-30 12:30:14+00:00,EternalHymn,"I'm so worried now.

If Say My Name can be edited this way then what more Over Me and the rest of the songs.",Republic of the Philippines,im worried say name edited way rest song
2023-03-30 12:29:48+00:00,Niks136072452,@srchafreen @in2itcosmetics Don't feel sorry Freen. You should focus o your health for now. We will wait for you until you feel better. We love youuuu always and really worried when you and becky got sick. Huhuh,Republic of the Philippines,dont feel sorry freen focus health wait feel better love youuuu always really worried becky got sick huhuh
2023-03-30 12:28:24+00:00,EternalHymn,"Oh gosh...

I am so worried...",Republic of the Philippines,oh gosh worried
2023-03-30 12:25:57+00:00,Skyhigh__13,I'm more worried about the glass 😂😂,"Banten, Indonesia",im worried glass
2023-03-30 12:23:39+00:00,indriagustiany,"They corrected the typo 🤭
I was a bit worried bcoz they deleted their prev Igs..😅
#2023LeeSeungGiAsiaTour
#LeeSeungGi #이승기
KR JP TW PH (May)
MY SG ID TH (Jun-Jul) https://t.co/1IEV9s1nKV",bandar lampung,corrected typo bit worried bcoz deleted prev ig kr jp tw ph may sg id th junjul
2023-03-30 12:16:51+00:00,chickayesika,"SKF event at ICE in 2018 they used 4 halls, 2 halls for the stage and in my opinion it wasn't too big. Now I'm not nervous about not being able to see them this close again, but worried about not getting any tickets at all because the venue is too small for a solo concert. 🥹 https://t.co/Bq5qxdFBC3","Jakarta, Indonesia",skf event ice used hall hall stage opinion wasnt big im nervous able see close worried getting ticket venue small solo concert
2023-03-30 12:13:00+00:00,snflwrgld,"@iiamsaf This is what I’m worried about when my period comes, just the judgment after I was already strict with my firm about not working overtime and not joining “compulsory” happy hour drinks this month",Hong Kong,im worried period come judgment already strict firm working overtime joining compulsory happy hour drink month
2023-03-30 12:07:54+00:00,Raqib_0,"@delilahluv19 You got onlyfans, twitter is the last thing you should be worried about","Dhaka, Bangladesh",got onlyfans twitter last thing worried
2023-03-30 12:00:16+00:00,rordraws4u,"im not even worried abt the one flaw
WHAT THE FUCK IS THAT FIRST QUALITY https://t.co/fFwFnpKwxK",Philippines,im even worried abt one flaw fuck first quality
2023-03-30 11:58:52+00:00,imjkzurc,"I am worried with Ateneo Lady eagles, badtrip si Coach O 🤭 #PVL2023",National Capital Region,worried ateneo lady eagle badtrip si coach
2023-03-30 11:40:45+00:00,herapersona,"he was trying to think about something. ""What's up?"" he asked.

""A-Die..."" LXC met his father's eyes, a bit worried. ""I... I think Shufu might have ingested the concoction.""

QHJ blinked at that before chuckling. ""Oh, that's fine. Even if he did ingest it, he won't get pregnant.""",Republic of the Philippines,trying think something whats asked adie lxc met father eye bit worried think shufu might ingested concoction qhj blinked chuckling oh thats fine even ingest wont get pregnant
2023-03-30 11:23:36+00:00,sugarcheenee,"@urstruly_teju @Nnattawin1 Oh thanks a lot ka🥺🥺💛💛💛 
 above Gov letter is quite complicated story, i worried that my trans/explanation might mislead to interfans.",ประเทศไทย,oh thanks lot ka gov letter quite complicated story worried transexplanation might mislead interfans
2023-03-30 11:18:10+00:00,BraMthizo08,@ObieSwaden I'm worried about the upcoming game seems like there's no vibe around at all...there's no drive to fill up loftus...,JHB,im worried upcoming game seems like there vibe around alltheres drive fill loftus
2023-03-30 11:16:08+00:00,morgpng,@isthiswu @GrottosNFT @Cmak0ta What happened to your account sir I was worried,Solana,happened account sir worried
2023-03-30 11:11:34+00:00,hazeljoves,"@MariaLouise_09 @CebuPacificAir Checked again, and the website now allows redemption of the super pass. Thanks @CebuPacificAir. You had me worried for a moment there. 😮‍💨",National Capital Region,checked website allows redemption super pas thanks worried moment
2023-03-30 11:08:26+00:00,RAHA_K_,@gemnarakkk I was honestly worried for the shits happened today. Glad to see them happy and goofy,"Dhaka, Bangladesh",honestly worried shit happened today glad see happy goofy
2023-03-30 10:58:58+00:00,QisyaKhadeeja,@doomsdart Just worried if delisting by Binance,Malaysia,worried delisting binance
2023-03-30 10:58:17+00:00,psychokind14,"Should we be worried? I really don't think we can sacrifice more time for Covid-19.
https://t.co/aCh6jyoAQD",,worried really dont think sacrifice time covid
2023-03-30 10:16:41+00:00,KuyaSky_88,"@19_saturn Promise.. T'was my first time receiving such bulky amount of money! 😅

The moment I waited for the ATM to dispense, it took.. a bit too long 😅... I was a bit worried already. 🥹😅

And.. there.. a fully stacked 30 pcs. of 100 Peso-bill in my hands 😂",Davao City,promise twas first time receiving bulky amount money moment waited atm dispense took bit long bit worried already fully stacked pc pesobill hand
2023-03-30 10:15:38+00:00,iamgandipan,The health minister is worried that government’s pensions bill has increased. Maybe you can start from yourself and your colleagues / ministers if you're really worried.,"Damansara, Selangor",health minister worried government pension bill increased maybe start colleague minister youre really worried
2023-03-30 10:08:47+00:00,__fangirlspace,"@Earth_Pirapat omg, please take care of yourself, stay healthy, take your medicine regularly, P'Earth. I'm so worried about you 🥺🤎","Hồ Chí Minh, Việt Nam",omg please take care stay healthy take medicine regularly pearth im worried
