Datetime,Username,Text,Location,Cleaned_Tweets
2023-03-27 02:51:30+00:00,njs_raine0316,@freenbeckfc I hope they are not overworked. That's a lot of places. Please make sure they get enough rest after every tour @IDOLFACTORYTH  #worried,Philippines,hope overworked thats lot place please make sure get enough rest every tour
2023-03-27 02:42:05+00:00,JeaneElleanna,"@shubhigoyal38 That's what i mean, why is she follow her everywhere i mean you know does she have a job or other activities than follow her here and there. I just don't wany anybody take an advantage from Pri. This is just my worried 😭🥹🤌 lol",Indonesia,thats mean follow everywhere mean know job activity follow dont wany anybody take advantage pri worried lol
2023-03-27 02:37:23+00:00,Angela_Tiwi,"It has been 5 years since Lin Yanjun made his debut, I asked him if he is calm about accepting getting older? He hesitated back and forth for a while, and answered without following the standard answer—""I'm not calm"", and he was also worried that his appearance would grow old. https://t.co/Ng1R9pjTFY","Bogor, Indonesia",year since lin yanjun made debut asked calm accepting getting older hesitated back forth answered without following standard answerim calm also worried appearance would grow old
2023-03-27 02:25:16+00:00,bakanekozumi,"@hanulyi i agree on this too. but on the other hand, seeing how even exo-sc fancon isn't sold out, it's also giving organizer the impression that the fandom isn't strong enough, im just worried that we're not gonna get these acts back in malaysia ever again",Malaysia,agree hand seeing even exosc fancon isnt sold also giving organizer impression fandom isnt strong enough im worried gon na get act back malaysia ever
2023-03-27 02:24:39+00:00,50waystoeatcock,@RobSchneider @goddeketal Yeah and we were worried about Cosby…. Been saying this since Jan 2020 when they only allowed the one “treatment” known to kill people (ventilators). #lookitup #Italy,Hawaii,yeah worried cosby saying since jan allowed one treatment known kill people ventilator
2023-03-27 02:20:18+00:00,notwinko,the way this tweet came through the moment i’m worried about how bad my eyebags and dark circles are getting kagskahss,malaysia,way tweet came moment im worried bad eyebags dark circle getting kagskahss
2023-03-27 01:56:08+00:00,Irukafishy,@tanhuiyi same feeling. I constantly worried about how to handle the death of my 4 old folks with only me and hubs. That's why I wanted 2 kids so they can support one another. Anyway BB knows I plan to donate my dead body for medical research.,Singapore,feeling constantly worried handle death old folk hub thats wanted kid support one another anyway bb know plan donate dead body medical research
2023-03-27 01:36:29+00:00,Billynaveed,"Money market funds have experienced a staggering $286bn in inflows over the past two weeks - this is more of a flood than a surge. 

It's understandable why business owners are worried about holding their cash in smaller banks. If you find yourself needin…https://t.co/KaBZWW6FyG",Singapore,money market fund experienced staggering bn inflow past two week flood surge understandable business owner worried holding cash smaller bank find needin
2023-03-27 01:36:05+00:00,weitlaner28,Really worried 🤡,Republic of the Philippines,really worried
2023-03-27 01:27:26+00:00,iqasyaa___,@Maraseang525 What is happening actually? Why people worried about him? Baby looks happy since last night. Even took pictures with lot of friends.,Malaysia,happening actually people worried baby look happy since last night even took picture lot friend
2023-03-27 01:25:50+00:00,LexOrtega01,I ain't worried about their sadness once I leave. I am more worried about what happens after that. I don't want anyone to be known as someone who knows someone who took their own life. That's a fucked up legacy for those who stay.,"Bacoor, Cavite",aint worried sadness leave worried happens dont want anyone known someone know someone took life thats fucked legacy stay
2023-03-27 01:17:09+00:00,marie_marrissa,I don’t know if I should be worried or I should laugh 🤣🤣,Malaysia,dont know worried laugh
2023-03-27 01:12:07+00:00,Gordo19571,@CarStan1114 Whew…….I was worried there.,MA,whewi worried
2023-03-27 01:02:23+00:00,Def_Style,"Hyperinflation has been around since the French Revolution.But with high inflation around the world, should we be worried about it in 2022? Inflation is at a 40-year-peak in the US and the UK. The Bank of England has warned that UK inflation may reach 10%…https://t.co/N0iSrY9ei1",Penang,hyperinflation around since french revolutionbut high inflation around world worried inflation yearpeak u uk bank england warned uk inflation may reach
2023-03-27 00:58:13+00:00,utr1907,and I promise I won't care anymore about someone who is worried about my existence.,"Kota Jambi, Jambi",promise wont care anymore someone worried existence
2023-03-27 00:56:30+00:00,d_joseph_,"It's Monday morning here, the #LakeShow loss still stings so bad, any tips on how I can cope at work though, it's very hard to do it for me. It's hard for me to focus tbh, more worried about the #LakeShow tbh.
#LakersTherapy 
@santimags3 @CarloLaker4life",Philippines,monday morning loss still sting bad tip cope work though hard hard focus tbh worried tbh
2023-03-27 00:53:26+00:00,ohhMaddygirl,I thought I lost you Latenight huhu 😩 was so worried minzey 😕,,thought lost latenight huhu worried minzey
2023-03-27 00:49:30+00:00,djadrichii05,"2 songs, 30+ impressions

One of my hardest and worried for the first time entering the event. Thank you so much for supporting and sending some Impressions for my song I submitted. Hope you enjoy and seeya soon in the next event!
#PABAT2023","Cavite, Philippines",song impression one hardest worried first time entering event thank much supporting sending impression song submitted hope enjoy seeya soon next event
2023-03-27 00:37:27+00:00,MaxCann_,"@theicyretros @Canes @rnd_brewing @Marchy4Byng one loss after a back to back im not too worried about, 16 point lead over u frauds is what you should be worried about😹💀",CGY,one loss back back im worried point lead u fraud worried
2023-03-27 00:34:22+00:00,bbarling,"@Jenna_MoonRiver @CooksRL @bildkistl @mayor_pete69 @jnmedina8989 I think we're talking about different parts of the conversation. As a Singaporean and NOT a Chinese national, he is not obligated to provide data to the Chinese government. Which is what everyone is worried about. Singapore is a different country to China. That's all I'm saying.","Bangkok, Thailand",think talking different part conversation singaporean chinese national obligated provide data chinese government everyone worried singapore different country china thats im saying
2023-03-27 00:32:53+00:00,WildHoney808,@squeakette3 @ourenglishroots I’m actually pretty worried about the few people who really thought I was talking about a child. If the whole text is read it’s hard to misunderstand. Especially with the pic of the chicken.  But people tend to half read things. 🤦🏽‍♀️I forget,Hawaii,im actually pretty worried people really thought talking child whole text read hard misunderstand especially pic chicken people tend half read thing forget
2023-03-27 00:25:27+00:00,the7lers,"270323 - 🐹💭 UPDATE

“I will not be in Korea for a month starting today” 
“Hmmㅜㅜ I’m worried. I’ve never been away for so long”",Malaysia,update korea month starting today hmm im worried ive never away long
2023-03-27 00:03:00+00:00,Kay819,I’m sure there’s more to this “headlining” issue but shouldn’t they be more worried about Tocha?? @BravoTV #QueensOfRandB,DC Metro,im sure there headlining issue shouldnt worried tocha
2023-03-26 23:56:57+00:00,askerlee,@Birchlabs @Ameen_Roayan Good intuition. But I'm still worried that at a later stage the high frequency details may still be influenced by the guidance signal.,Singapore,good intuition im still worried later stage high frequency detail may still influenced guidance signal
2023-03-26 23:49:23+00:00,arwajid,@AamnaFasihi Thanks for sharing...  I've been very worried for him too. This whole situation is so distressing .,Islamabad,thanks sharing ive worried whole situation distressing
2023-03-26 23:29:17+00:00,renniefantastic,"@mattdellok This is laughable, since Harris Green is essentially dead due to your podcast mate's last minute parking amendment. Council is more worried about parking vs. housing.",Victoria,laughable since harris green essentially dead due podcast mate last minute parking amendment council worried parking v housing
2023-03-26 23:13:16+00:00,hollyintheskyy,"Hope everyone who sees this has a good day. I know we’ve all been worried. @peatwasu @fort_fts Have a good day, boys. 

#Peatwasu #CaptainPeat #FortFTS #ComeFortZon #BabyFeat #HaveAFortFTSDay #HaveAPeachfulDay https://t.co/6YGRjM3wgw",Thailand,hope everyone see good day know weve worried good day boy
2023-03-26 23:10:39+00:00,agustdbtsde,that they were worried if what he said can be uploaded only to know that he is jimin 😭,Malaysia,worried said uploaded know jimin
2023-03-26 23:07:26+00:00,komondc,"@MediClit Also, the point is to show diversity, it's not like you were worried about porn showing labiaplasties once and again, that would be like setting some standard due to repetition.

But looking at this artwork I don't think anyone ends ""hey, that's the one kind that looks right"".",Asturias,also point show diversity like worried porn showing labiaplasties would like setting standard due repetition looking artwork dont think anyone end hey thats one kind look right
2023-03-26 22:40:23+00:00,satsuyurami,"I can't remember which one. Belial / Lucifer was once in trending topic, and religious normies were worried that nowadays children are into satan worshipping","Southeast Asia, Indonesia",cant remember one belial lucifer trending topic religious normies worried nowadays child satan worshipping
2023-03-26 22:39:15+00:00,nawagadj,@abcnews Israelis worried that they could be treated like they are Palestinian.,"Darwin, Northern Territory",israeli worried could treated like palestinian
2023-03-26 22:30:57+00:00,abasitkhawaja,"@Xadeejournalist @ImranKhanPTI @amnestysasia @hrw Zaidi Sb you really shouldn't be worried about him. Wherever he is, he must be explaining the reasons for his breach of contract with his previous handlers.",Islamabad,zaidi sb really shouldnt worried wherever must explaining reason breach contract previous handler
2023-03-26 22:17:44+00:00,natalie905,@notcapnamerica Gross. Judge Joe is worried about “hEtErOpHoBiA” but not about being a drunken fool hitting on girls that are in their 20’s? https://t.co/4oxIujfaPv,DC METRO,gross judge joe worried heterophobia drunken fool hitting girl
2023-03-26 21:45:38+00:00,WeaponProject13,"*thirteen stared from a distance, worried for her mental health. He knows what that hopeless miracle is, whether he was going to find it or not was a tough decision.*

Sigh...can't believe I'm doing this...",Singapore,thirteen stared distance worried mental health know hopeless miracle whether going find tough decision sighcant believe im
2023-03-26 21:31:04+00:00,happinessys84,"when he made the song Eat's Ok it was inspired by fans who were worried about his diet. so he made this song so his fans don't have to worry about his condition. &amp; he always thinks about ELF, some songs, updates and all that about elfs. He really loves his fans https://t.co/b9gwPMjjCl",Indonesia ,made song eats ok inspired fan worried diet made song fan dont worry condition amp always think elf song update elf really love fan
2023-03-26 21:28:09+00:00,Red_Orthodox,@JosepBorrellF Why are you so worried? After all it’s just a defensive alliance just like NATO 😂,Asia,worried defensive alliance like nato
2023-03-26 19:57:04+00:00,Brent80339216,I am worried that #BibiNetanyahu meets the same fate as  #YitzhakRabin. #Israel is an extremely dangerous place right now. https://t.co/h7gEALjOp0,"Angeles City, Philippines ",worried meet fate extremely dangerous place right
2023-03-26 19:44:33+00:00,joviofs,"Concise and insightful. Much easier than reading up an article.
All this time, I've been consuming almost the daily limit of 400mg of caffeine.
Worried, I asked how this could've affected my health. https://t.co/AS71Y837Os","Curup, Indonesia",concise insightful much easier reading article time ive consuming almost daily limit mg caffeine worried asked couldve affected health
2023-03-26 19:28:42+00:00,meekehh,SAME AFTER BIN TURNED FROM LEFT TO CENTER AISLE I COULDNT FIND EITHER OF THEM AND GOT WORRIED 😭,"Bacolod City, Philippines",bin turned left center aisle couldnt find either got worried
2023-03-26 19:06:49+00:00,VelemseniVilane,"@mbalimcdust @FlySafair When taking flights.... I'm always worried that someone can plant illegal stuff in the bag and I can end being arrested.... that bag search on arrivals becomes very traumatic. 
If they can break into the bag, they can plant stuff too🤷‍♂️ ..... really scary.",SA,taking flight im always worried someone plant illegal stuff bag end arrested bag search arrival becomes traumatic break bag plant stuff really scary
2023-03-26 19:05:33+00:00,officialbepi,"Yes, I am a little worried but I am ready to make another huge jump.","Dili, Timor-Leste",yes little worried ready make another huge jump
2023-03-26 18:58:17+00:00,MrPuggu,"[ LiVash - Trimax ]

Livio : I knew I could never replace Nico-niisan.

Livio : But I can't see you living without love...

Livio : I love you!! I'm worried about you.💦💦

Vash : Calm down Livio... 

Cry baby Livio ...😂😂 

--- วาดไว้เมื่อกุมภาแต่ไม่ได้ลง ชอบคู่นี้นะ น่ารักกก https://t.co/Yg6zW0YyPT",ประเทศไทย,livash trimax livio knew could never replace niconiisan livio cant see living without love livio love im worried vash calm livio cry baby livio
2023-03-26 18:44:28+00:00,que_margiela,@tumi_tulipz old ladies (bo fill up Macdonald)worried about what kids are doing really dusts me🤣🤣🤣🤣,Jhb,old lady bo fill macdonaldworried kid really dust
2023-03-26 18:44:21+00:00,Sannylu,"@piratequeen_ya It's a pirate fight, I think he would totally respect the result.
Just like he was worried about Smoker when Law defeated him in PH, but didn't do much to interfere.
He also truts the both of them n.n",España,pirate fight think would totally respect result like worried smoker law defeated ph didnt much interfere also truts nn
2023-03-26 18:30:58+00:00,marieri_01,@mishamoonberry I am feeling extremely worried for all of us after experienced that shit 💀,Việt Nam,feeling extremely worried u experienced shit
2023-03-26 18:16:43+00:00,hereForBSumett,"take some pills and call your psychologist asap, seriously I’m so worried about your mental health.","Bangkok, Thailand",take pill call psychologist asap seriously im worried mental health
2023-03-26 18:09:13+00:00,Algui10,"I just got home from work, so I couldn't see your performance in the first time. But knowing you guys are going on a world tour, really excited, but also worried about your health, hope you all take care of yourself @srchafreen @AngelssBecky",Taiwan,got home work couldnt see performance first time knowing guy going world tour really excited also worried health hope take care
2023-03-26 18:01:19+00:00,Sash_or_Chicane,"@Jon_Chalk1 @BadVaccineTakes Oh for sure, but what makes this one super weird is she's actually admitting that the vaccine works.

A more typical response would be along the lines of I'm not worried about the Measles outbreak at all because of muh essential oils.","Bangkok, Thailand",oh sure make one super weird shes actually admitting vaccine work typical response would along line im worried measles outbreak muh essential oil
2023-03-26 18:01:17+00:00,InnMiazi,"Why are people worried about TikTok?

Lots of people in the USA are worried about the amount of data any social media app has, but there are more worries about TikTok because it's owned by a Chinese company.

#tiktokhot #TikTokライブ #tiktokban https://t.co/T6HBzgOeGq","Dhaka, Bangladesh",people worried tiktok lot people usa worried amount data social medium app worry tiktok owned chinese company
2023-03-26 17:57:10+00:00,BarelyStandin,"2/2. She posts videos of herself on FB w/assault weapons glorifying their use yet she protests against Tik-Tok showing weaponry. They also claim they're worried about our data collection when they misuse it.🤦🏾‍♂️🤬
 https://t.co/w2NKYKBRLK",HADES,post video fb wassault weapon glorifying use yet protest tiktok showing weaponry also claim theyre worried data collection misuse
2023-03-26 17:50:54+00:00,onriwantsuitta,Kinda worried about something,"Kulai Jaya, Johor",kinda worried something
2023-03-26 17:47:05+00:00,ismaenk,"@rubrumlapis sorry for make you scared of me sol, I'm just worried about you since you miscalled me earlier

I assume something happened with you since after you miscalled me you didn't tell about your boss is calling you again

so I try to contact you more with everything I try","Jakarta, Indonesia",sorry make scared sol im worried since miscalled earlier assume something happened since miscalled didnt tell bos calling try contact everything try
2023-03-26 17:43:26+00:00,_GhettoSmurf,I’m worried about Capricorn,In my bag,im worried capricorn
2023-03-26 17:37:05+00:00,FarahD5,Lately hidup ni terasa 1 macam lah...should I be worried???? 😓,Malaysia,lately hidup ni terasa macam lahshould worried
2023-03-26 17:31:08+00:00,luckyjonii,"@CFCPys But he’s 22, he should be doing a bit better. I expect mistakes from Santos, Carney, Hutchinson, Gaga… idk I’m a bit worried about this signing…",España,he bit better expect mistake santos carney hutchinson gaga idk im bit worried signing
2023-03-26 17:26:20+00:00,luckyjonii,"@Blue_Footy I’m a bit worried about this signing, it’s very difficult for him always to get into the match",España,im bit worried signing difficult always get match
2023-03-26 17:03:38+00:00,Karon25041119,"@SergioM65955451 @SpartaJustice If you’re worried, jump.  I submit that the answer is NOT to
insist people get jabbed whilst claiming the jab is safe/ effective knowing it causes excess
deaths (38%), skyrocketing
infertility, fetal death,
miscarriage, etc. “Fixing” a
situation by lying &amp; coercion is horrid. https://t.co/fgrA6bLFnt",sofa,youre worried jump submit answer insist people get jabbed whilst claiming jab safe effective knowing cause excess death skyrocketing infertility fetal death miscarriage etc fixing situation lying amp coercion horrid
2023-03-26 16:47:23+00:00,PropheticFox_,"@SkepticTeaTime She smiled softly at their answer, already beginning her slow descent into the realm of sleep but she wasn't worried.

Why should she when she's in Nagisa's safe and capable hands?

""Mmmm.....zzzzz.....zzzzz""",TABOO,smiled softly answer already beginning slow descent realm sleep wasnt worried shes nagisas safe capable hand mmmmzzzzzzzzzz
2023-03-26 16:19:43+00:00,CurtisHurshal,"@ZmajSaJuga Unpopular opinion. I’m worried. Our midfield doesn’t create as much as we need and it could bite us. If our midfield steps up we win, if we depend on dedic it’s gonna be rough",Nam ,unpopular opinion im worried midfield doesnt create much need could bite u midfield step win depend dedic gon na rough
2023-03-26 16:14:32+00:00,Jacki_Jam,@ClownWorld_ we have hordes of aggressive violent hairy-arsed blokes running round in wigs and beards pretending to be women and demanding we accept their magical 'transformation' and people are worried about the colour of memes?  💩,Singapore & Bangkok,horde aggressive violent hairyarsed bloke running round wig beard pretending woman demanding accept magical transformation people worried colour meme
2023-03-26 15:58:07+00:00,SE0KMINe,oh they’re worried about his health if the rumor turns out to be true. understandable. it will definitely overlap with the group sched and there’s a rumored bss cb too at the end of the year ☹️,Ph,oh theyre worried health rumor turn true understandable definitely overlap group sched there rumored bs cb end year
2023-03-26 15:54:11+00:00,kirantweetme,"@shaandelhite Ppl seems more worried about caste , what he said etc than those huge defaulters who fled. V Strange. It affects every one if such number increases.",blore,ppl seems worried caste said etc huge defaulter fled v strange affect every one number increase
2023-03-26 15:53:25+00:00,kerolamryy,Worried sometimes,"Langkawi, Kedah",worried sometimes
2023-03-26 15:49:32+00:00,LoudDunkMummy,"@milkydunkie Me too... I mean, introverts are comfortable with their close friends and i see Dunk's friends all spread out in different teams. And i always worry abt him in after parties, worried if he has someone to accompany him as it's very hard for introverts to be expected to just mingle",,mean introvert comfortable close friend see dunk friend spread different team always worry abt party worried someone accompany hard introvert expected mingle
2023-03-26 15:28:30+00:00,Tom83491351,"American politicians worried about a social media platform their kids go on

They should be more worried about sending their kids to schools 👀 

#tiktokban #tiktok #american #stupid","Phuket, Thailand",american politician worried social medium platform kid go worried sending kid school
2023-03-26 15:23:50+00:00,Hopehope_G_hope,"@DeItaone Don't believe this.. the more u say it, the more worried they really feel",Singapore,dont believe u say worried really feel
2023-03-26 15:19:58+00:00,live_elsewheres,And kinda feeling worried about socialising in jap???  Basic jap == huge language barrier,Singapore,kinda feeling worried socialising jap basic jap huge language barrier
2023-03-26 15:16:54+00:00,Amibutnotweeb,"i was worried that starfield will be 18+ but then i remember, this year im going to be 20 Aware https://t.co/Y4tnxB3qeX",Jakarta,worried starfield remember year im going aware
2023-03-26 15:08:30+00:00,GuisbertCherry,"After a few minutes, Lamour was able to get in touch with Mirror. I couldn't hear what Mirror was saying, but Lamour's face turned even more pale and worried as he listened.",Thailand,minute lamour able get touch mirror couldnt hear mirror saying lamours face turned even pale worried listened
2023-03-26 15:08:30+00:00,GuisbertCherry,"He was talking to a device called AUBE, asking for it to help him contact Mirror. It was clear that Lamour was worried and anxious about the situation in the city, and he seemed to think that Mirror was responsible for all the chaos.",Thailand,talking device called aube asking help contact mirror clear lamour worried anxious situation city seemed think mirror responsible chaos
2023-03-26 14:54:30+00:00,Anihope09,@pphuwinaravit Ohh...thank god..if u got any news..kindly update dear..I'm so worried,,ohhthank godif u got newskindly update dearim worried
2023-03-26 14:39:13+00:00,JamesPagasa,"Worried about AI taking your lawyer job?

 Remember, your unique skills matter! 

Don't be a 'shitty' lawyer.

Adapt and Excel. 

 #AI #law",Philippines ,worried ai taking lawyer job remember unique skill matter dont shitty lawyer adapt excel
2023-03-26 14:27:49+00:00,buixss,"@leaena_octo It's been 2 months, but I can't recover from depression, I study at university, I've accumulated so much work, but I can't concentrate on them and it literally destroys my future) I'm on the verge of expulsion, but I'm still only worried about Biu",Таиланд ,month cant recover depression study university ive accumulated much work cant concentrate literally destroys future im verge expulsion im still worried biu
2023-03-26 14:09:01+00:00,farmerxchef,"Ang cute nun guy kanina sa SB ba, and my friend kinda worried kasi she thought he was being harrassed.",General Santos City,ang cute nun guy kanina sa sb ba friend kinda worried kasi thought harrassed
2023-03-26 14:05:22+00:00,MyatSuAung3,@EXO9NATIONSPICK Hoping this to happen ~ 🙏 I'm so worried these days for him. I know that we all did our best to support him but on the other side I'm worrying too much for him.,"Lyon, France",hoping happen im worried day know best support side im worrying much
2023-03-26 14:00:47+00:00,JVee121194,"Text scams/phishing are still ongoing and its scary because they know your full name. @NTCPH what will you do about this? I’ve been receiving a lot of these and I’m worried that if I’d mistakenly click a link, it will affect my phone’s security. This is frustrating. :( https://t.co/xQGHyriW5E",Makati City,text scamsphishing still ongoing scary know full name ive receiving lot im worried id mistakenly click link affect phone security frustrating
2023-03-26 14:00:02+00:00,erldcn,"anyone do laptop repairs or have some technical/hardware know how? got a real bad sound issue coming from my laptop that has me real worried

(all functions seem normal for now at least)","MNL, PH",anyone laptop repair technicalhardware know got real bad sound issue coming laptop real worried function seem normal least
2023-03-26 13:57:56+00:00,_StevenHi,"If anything, writing things down helps to clear it out of your system

The flow that I use:
1. What am I worried about?
2. What can I do
3. What I am grateful for
4. What I want to improve

2nd pic is view from @VisionMalaya Valiant https://t.co/npnulBLvCC",Bendang ,anything writing thing help clear system flow use worried grateful want improve nd pic view valiant
